{
    "id": 12345,
    "name": "Lorem ipsum",
    "description": "Lorem ipsum dolor",
    "tiles": 12345,
    "center": {
        "latitude": 123,
        "longitude": 123
    },
    "zoom": 2,
    "pois": [1, 2, 3, 4],
    "metadata": {
        "created": "some time format",
        "edited": "some time format",
        "creator": "User name",
        "editor": "User name"
    }
}